{
  "schema": "search_response.v1",
  "query": "array map",
  "vertical": "devdocs",
  "took_ms": 12.5,
  "degraded": true,
  "total": 2,
  "results": [
    {
      "rank": 1,
      "url": "http://fixture.loom.test/js/array-map.html",
      "title": "Array.prototype.map()",
      "snippet": "The ▌map▐ method creates a new ▌array▐ populated with the results of calling a function on every element.",
      "score": 14.2
    },
    {
      "rank": 2,
      "url": "http://fixture.loom.test/js/array-filter.html",
      "title": "Array.prototype.filter()",
      "snippet": "Like ▌map▐, filter returns a new ▌array▐ without mutating the original.",
      "score": 9.1
    }
  ],
  "suggestion": {
    "text": "array map"
  }
}
